{
  "$schema": "https://json-schema.org/draft/2020-12/schema",
  "$id": "https://schemas.adumun.org/work-management/work-item.schema.json",
  "title": "ADÜMÜN Work Item",
  "type": "object",
  "additionalProperties": false,
  "required": ["schema_version", "work_id", "title", "type", "category", "areas", "state"],
  "properties": {
    "schema_version": {"const": "work-item.v0.1.0"},
    "work_id": {"type": "string", "minLength": 1},
    "title": {"type": "string", "minLength": 1},
    "type": {"enum": ["STORY", "BUG", "TASK", "SPIKE", "EXPERIMENT", "TECHNICAL_DEBT", "INCIDENT"]},
    "category": {"enum": ["PRODUCT", "ENGINEERING", "ARCHITECTURE", "DATA", "SECURITY", "INFRASTRUCTURE", "QUALITY", "DOCUMENTATION", "OPERATIONS", "COMPLIANCE", "DESIGN", "RESEARCH"]},
    "areas": {
      "type": "array",
      "minItems": 1,
      "uniqueItems": true,
      "items": {"type": "string", "pattern": "^[A-Z0-9_:.\\-]+$"}
    },
    "source": {"enum": ["STRATEGY", "INITIATIVE", "USER", "CLIENT", "INCIDENT", "AUDIT", "RISK", "MAINTENANCE", "TECHNICAL_DISCOVERY", "EXTERNAL_REQUIREMENT"]},
    "priority": {"enum": ["P0", "P1", "P2", "P3"]},
    "severity": {"enum": ["SEV0", "SEV1", "SEV2", "SEV3", "SEV4"]},
    "state": {"enum": ["PROPOSED", "REFINING", "READY", "IN_PROGRESS", "BLOCKED", "IN_REVIEW", "DONE", "CANCELED", "DEFERRED"]},
    "owner": {"type": ["string", "null"]},
    "acceptance_criteria": {"type": "array", "items": {"type": "string", "minLength": 1}},
    "evidence_refs": {"type": "array", "items": {"type": "string", "minLength": 1}, "uniqueItems": true},
    "provider_refs": {
      "type": "array",
      "items": {
        "type": "object",
        "additionalProperties": false,
        "required": ["provider", "external_id"],
        "properties": {
          "provider": {"type": "string", "minLength": 1},
          "external_id": {"type": "string", "minLength": 1},
          "url": {"type": "string"},
          "project": {"type": "string"}
        }
      }
    },
    "reclassification": {
      "type": ["object", "null"],
      "additionalProperties": false,
      "required": ["from_type", "to_type", "reason"],
      "properties": {
        "from_type": {"type": "string"},
        "to_type": {"type": "string"},
        "reason": {"type": "string", "minLength": 1},
        "decision_ref": {"type": "string"}
      }
    }
  }
}
